"User ID","User Name","Text","Timestamp"
"thankthemajor","thankthemajor","So because you dislike the political style of some members of a group, you want to take their rights away as a punishment?","1450666060"
"CaptainFloat","CaptainFloat","No but I won't support something just to get them off my back. ","1450666868"
"thankthemajor","thankthemajor","What? You said that gay rights are an intrusion on your happiness. Gay people have been able to marry each other across the country since June. Are you any less happy?","1450666966"
"CaptainFloat","CaptainFloat","Yeah America is kinda in the shitter right now. I am actively unhappy when I see gay people make out, or be intimate ","1450667851"
"RelaxingOnTheBeach","RelaxingOnTheBeach",">  I am actively unhappy when I see gay people make out, or be intimate

Do you think if they can't get married you will be less likely to see gay people making out?","1450669225"
"CaptainFloat","CaptainFloat","If getting married is the peak of having an intimate relationship and gay people can't do that it would decrease the number of homosexuals. I am not convinced every person who is gay is actually gay. I believe because it has become a very popular topic recently people are using it as an excuse for circumstances in their life.","1450669671"
"butsicle","butsicle","Do you think that you could be gay if you tried really hard? ","1450670468"
"CaptainFloat","CaptainFloat","Personally? Maybe for money but otherwise no. 
Now someone who was in s really bad place in their life and didn't have an answer for if? Yeah I think they could and do ","1450670909"
"butsicle","butsicle","So for money you could make yourself sexually attracted to a man and enjoy gay sex?","1450673155"
"CaptainFloat","CaptainFloat","Well I would enjoy the money post steamy-gay sex
And we're talking a lot of money here
","1450673274"
"butsicle","butsicle","I asked if you'd enjoy the steamy gay sex.","1450673628"
"CaptainFloat","CaptainFloat","Depends whose asking ","1450673797"
"butsicle","butsicle","This has been an enjoyable thread and I appreciate your satire. You're very convincing.","1450673894"
