"User ID","User Name","Text","Timestamp"
"FiveofSwords","FiveofSwords","the democrats jsut want to 'shut down' white people. Im a white person. I can assure you that people trying to 'shut me down' are going to get nothing but civil war. you like that idea?","1492324020"
"bracs278","bracs278","What do you mean by shutting down?","1492324468"
"FiveofSwords","FiveofSwords","i mean they want to oppress white people. especially if they happen to be men.","1492325051"
"Iswallowedafly","Iswallowedafly","Is giving you the share of the pie you deserve shutting you down. 

I mean you will still get a massive piece of the pie. 

It just won't be as massive as it was before. ","1492346810"
"FiveofSwords","FiveofSwords","You are going to decide how much pie ive earned? really? you have any change in your pocket? cause I think i deserve some of it. Dont worry, ill leave you some.","1492346986"
"Iswallowedafly","Iswallowedafly","But you understand at some base level that whites have had massive advantages. 

If you give a tad back you will still have advantages. 

Start competing by merit. If you think you deserve something compete with everyone else and deserve it. Unless you think you should just barely graduate high school and get a high paying job. work for it. don't just get it handed to you. ","1492347196"
